Male	24	Yes	5	Male	24	No	Completed secondary school	Yes	Female	45	No	Completed primary school	No	Male	47	Yes	Completed primary school	Yes	Female	22	0	Completed secondary school	No	Male	26	0	Completed secondary school	Yes	0	0	0	0	0	0	0	0	0	0	0	0	0	0	0	0	0	0	0	0	0	0	0	0	0	2	0	7	Yes	Yes	1	24	Male	0	0	0	0	0	0	0	0	2	45	Female	50	47	Male	50	0	0	0	0	0	0	0	0	0	November	27	YER	81000.0	December	26	YER	156000.0	August	25	YER	150000.0	September	0	0	0.0	October	0	0	0.0	January	0	0	0.0	February	0	0	0.0	Yes	They need hard	Yes	Yes	Male	Yes	They needed me	be a building teacher	Yes	0	Yes	مثل كل الشقات	When the work continues, there is a change in terms of income, and if the work is interrupted, there is no change	One they took it back because they were satisfied, but I don&#39;t know this one	Qhat	Meat	Cow pea	0	60.0	0.0	20.0	25.0	0.0	30.0	75.0	0	5.0	0.0	75.0	0.0	0.0	10.0	40.0	50.0	0.0	0	0	40.0	0	150.0	0.0	0	65.0	3	0	0	0	0	0	0	0	0	1	0	0	0	0	0	0	0	0	0	0	0	0	0	0	0	0	0	0	0	1	0	0	0	0	0	0	0	0	0	0	0	Sister's wedding 2021	0	0	0	0	0	0	0	0	0	0	0	1200	Daily wage work	- I learned how to build the Zabur with the companions of Saada. - I learned how to mix the bowls, how to mix the soil and make water for it in the basin in several spots, and how to soak the soil with water, and I learned roughing	Shaqi stone and mud in Al-Amair	Yes	32.0	Yes	0	An ancient civilization the right of our fathers and grandfathers	I didn't use anything else	Didn't get anything else	Restoration with construction and restoration materials	The wood should be custom wood and the materials that make it custom	Protect homes and wood from exposure to water	Sana'a	Alsabeyn	Bayt bus	60.0	32.8	26.0	Some secondary school	Completed secondary school	Completed secondary school	60.0	3	0.0	24	Male	20.0	0.0	24.0	24.0	40.0	50	46.0	1548.0	221.14285714285714
Male	36	Yes	2	Male	36	Yes	Some primary school	Yes	Female	28	0	Completed primary school	No	0	0	0	0	0	0	0	0	0	0	0	0	0	0	0	0	0	0	0	0	0	0	0	0	0	0	0	0	0	0	0	0	0	0	0	0	0	0	0	0	2	1	5	Yes	Yes	1	36	Male	0	0	0	0	0	0	0	0	1	36	Male	100	0	0	0	0	0	0	0	0	0	0	0	0	November	19	YER	114000.0	December	24	YER	144000.0	January	24	YER	144000.0	February	24	YER	144000.0	March	24	YER	144000.0	April	4	YER	24000.0	May	0	0	0.0	Yes	Reason for construction experience	Yes	No	Male	Yes	Reason for construction experience	Nothing is enough hard	Yes	0	Yes	مثل اجر الشاقي	Praise be to God, the situation is not good, otherwise in this situation, this misery is not enough for you	I do not know	Meat	Qhat	Wheat flour	0	120.0	33.3	40.0	40.0	0.0	46.6	200.0	0	10.0	0.0	113.3	13.3	53.3	20.0	80.0	86.6	0.0	0	0	53.3	0	200.0	0.0	0	80.0	6	0	0	0	0	0	0	0	0	1	0	0	0	0	0	0	0	0	0	0	0	0	0	0	0	0	0	1	0	1	0	0	0	0	0	0	0	0	0	0	0	All months are difficult, but one keeps pace with time from here and here	0	0	0	0	0	0	0	0	0	0	0	1445	daily payment	Repairing homes, such as the damaged stones in Sas Al-Bait. Restoration of damaged roofs, changing roofs, lining the houses with water, building a plant, changing stone and building	Wall grafting, restoration, building, stone and clay	Yes	32.0	Yes	0	I have full needs, but I don't have anything specific in my head now	I have full needs, but I don't have anything specific in my head now	I have full needs, but I don't have anything specific in my head now	Home repairs and renovations	Repairing damaged roofs and changing roofs	Describe the houses and construction of the metal	Sana'a	Alsabeyn	Bayt bus	50.0	32.0	32.0	Some primary school	Completed primary school	Some primary school	50.0	1	0.0	36	Male	50.0	0.0	36.0	36.0	50.0	0	36.0	2856.0	571.2
Female	30	Yes	1	Female	30	Yes	University	Yes	0	0	0	0	0	0	0	0	0	0	0	0	0	0	0	0	0	0	0	0	0	0	0	0	0	0	0	0	0	0	0	0	0	0	0	0	0	0	0	0	0	0	0	0	0	1	0	2	Yes	No	1	30	Female	0	0	0	0	0	0	0	0	1	30	Female	100	0	0	0	0	0	0	0	0	0	0	0	0	September	25	USD	200.0	February	0	0	0.0	January	0	0	0.0	March	0	0	0.0	April	0	0	0.0	May	0	0	0.0	June	0	0	0.0	Yes	The authority’s employees have experience in surveying and data entry	Yes	No	Male	Yes	The answer is yes	In entering data	No	قليل بالنسبه للعمل 	No	0	My financial conditions improved somewhat, and this month I gained experience	I do not know anyone	School - Madrassa	Clothes	Rice	0	0.0	0.0	5.0	6.0	10.0	15.0	20.0	0	0.0	0.0	0.0	0.0	10.0	5.0	0.0	20.0	34.0	50	0	10.0	0	0.0	0.0	0	0.0	1	2	0	0	0	1	1	0	1	0	0	0	0	0	0	0	0	0	0	0	0	0	0	0	0	0	0	0	0	1	0	0	0	1	0	0	0	0	0	0	1	The end of the year and the beginning of the year there are no works	0	0	0	In Ramadan and Eid	0	0	0	0	0	0	The end of the year and the beginning of the year there are no works	1000	An employee in the Antiquities Protection Authority	laziness	Government Employee	No	0.0	Yes	0	Old Sana'a is a very old historical city	70 percent of it is endowed	Some construction sites have buried archaeological sites under them	Preserving Yemen's heritage	Discover buried sites	None	Amanah Aleasimuh	Alamanih	Sanea' alqadimuh	0.0	30.0	30.0	University	University	University	100.0	1	100.0	30	Female	100.0	100.0	30.0	30.0	100.0	100	30.0	200.0	100.0
Female	45	Yes	4	Male	70	No	No formal education	No	Female	45	Yes	Some primary school	Yes	Female	22	0	Completed secondary school	No	Female	19	0	Completed secondary school	No	0	0	0	0	0	0	0	0	0	0	0	0	0	0	0	0	0	0	0	0	0	0	0	0	0	0	0	0	0	0	0	0	4	Yes	No	1	45	Female	0	0	0	0	0	0	0	0	1	45	Female	100	0	0	0	0	0	0	0	0	0	0	0	0	April	10	USD	33.0	May	15	USD	50.0	June	15	USD	58.0	January	0	0	0.0	February	0	0	0.0	March	0	0	0.0	July	0	0	0.0	Yes	Because there is no salary, everyone was selected for this program	Yes	Yes	Male	Yes	Because there are no salaries, everyone was chosen to participate in this program	I do not know	No	المبلغ قليل جدا ولا يكفي	No	0	The financial situation improved somewhat during the period of work	I do not know anyone	Wheat flour	Rice	Kerozene	28	0.0	0.0	5.0	0.0	0.0	16.0	10.0	0	0.0	0.0	0.0	0.0	0.0	10.0	0.0	15.0	0.0	0	0	8.0	0	0.0	0.0	0	0.0	3	3	0	0	0	0	0	0	1	1	0	0	0	0	0	0	0	0	1	0	0	0	0	0	0	0	0	0	0	1	1	0	0	0	0	0	0	0	0	0	0	The beginning of a year and there is no work	The beginning of a year and there is no work	0	0	0	0	0	0	0	0	0	0	800	Cleaner in the body	None	Sewing prayer clothes	No	0.0	Yes	0	None	None	None	Preserving Yemen's heritage	None	None	Amanah Aleasimuh	Amanah aleasimuh	Sanea' alqadimuh	25.0	39.0	33.5	Completed primary school	Completed secondary school	Some secondary school	25.0	1	100.0	45	Female	25.0	100.0	45.0	45.0	25.0	100	45.0	141.0	35.25
Female	30	No	4	Male	41	Yes	Completed secondary school	Yes	Female	58	0	No formal education	No	Female	30	0	University	No	Female	26	0	Completed secondary school	No	0	0	0	0	0	0	0	0	0	0	0	0	0	0	0	0	0	0	0	0	0	0	0	0	0	0	0	0	0	0	0	0	4	Yes	No	1	30	Female	0	0	0	0	0	0	0	0	2	58	Female	50	30	Female	50	0	0	0	0	0	0	0	0	0	April	25	USD	120.0	December	25	USD	60.0	January	0	0	0.0	February	0	0	0.0	March	0	0	0.0	May	0	0	0.0	June	0	0	0.0	No	0	Yes	Yes	Male	No	0	engineering software	Yes	0	No	0	The situation has improved somewhat	I don't know anyone because everyone worked	Meat	Fruits	Cow pea	0	0.0	0.0	0.0	0.0	0.0	0.0	50.0	0	0.0	0.0	20.0	0.0	30.0	0.0	0.0	0.0	0.0	0	0	0.0	0	0.0	0.0	0	0.0	2	2	0	0	0	0	0	0	0	1	0	0	0	0	0	1	0	0	0	0	0	0	0	0	0	0	0	0	0	0	0	0	0	1	0	0	1	0	0	0	0	0	0	0	0	In Ramadan and holidays.	0	0	In Ramadan and holidays	0	0	0	0	1200	Factor	Experience in photography and building measurements, dealing with engineers and people	employee in the body	No	0.0	Yes	0	Discovering new archaeological sites	None	None	Preserving and restoring old Sana'a because it is a teacher and civilization	None	None	Amanah Aleasimuh	Amanah aleasimuh	Sanea' alqadimuh	25.0	38.75	35.5	Some secondary school	University	Completed secondary school	25.0	1	0.0	41	Male	25.0	100.0	30.0	30.0	50.0	100	44.0	180.0	45.0
Female	38	No	3	Male	40	Yes	Completed secondary school	Yes	Female	38	0	Completed primary school	Yes	Female	20	0	Completed secondary school	No	0	0	0	0	0	0	0	0	0	0	0	0	0	0	0	0	0	0	0	0	0	0	0	0	0	0	0	0	0	0	0	0	0	0	0	2	0	5	Yes	No	1	38	Female	0	0	0	0	0	0	0	0	2	40	Male	50	38	Female	50	0	0	0	0	0	0	0	0	0	September	25	USD	200.0	October	10	USD	100.0	January	0	0	0.0	February	0	0	0.0	March	0	0	0.0	April	0	0	0.0	May	0	0	0.0	No	0	No	No	Male	No	0	Teaching sewing	Yes	0	No	0	I was able to enroll my daughter in university	I do not know anyone	Education	Not form above	Books	0	0.0	0.0	0.0	0.0	0.0	0.0	0.0	0	0.0	0.0	0.0	0.0	0.0	0.0	0.0	0.0	0.0	0	0	0.0	0	0.0	0.0	10	200.0	2	1	0	0	0	0	0	0	0	0	0	0	0	0	0	0	0	0	0	0	0	0	0	0	0	0	1	1	0	0	0	0	0	0	0	0	0	1	0	0	0	0	0	0	0	0	0	0	0	The beginning of schools and universities	0	0	0	2000	An employee in the body, I work as a tailor	How to photograph accurately	sewing	No	0.0	Yes	0	Knowing the ancient heritage	I met a tomb in a historical Muammar	Get to know the old fashioned	The need to preserve the ancient heritage	None	None	Amanah Aleasimuh	Sanea' alqadima	Sanea' alqadimuh	33.33333333333333	32.666666666666664	38.0	Some secondary school	Completed secondary school	Completed secondary school	66.66666666666666	2	50.0	40	Male	33.33333333333333	100.0	38.0	38.0	66.66666666666666	50	39.0	300.0	60.0
Female	33	Yes	2	Female	33	Yes	University	Yes	Male	33	0	University	Yes	0	0	0	0	0	0	0	0	0	0	0	0	0	0	0	0	0	0	0	0	0	0	0	0	0	0	0	0	0	0	0	0	0	0	0	0	0	0	0	0	0	1	3	Yes	Yes	1	33	Female	0	0	0	0	0	0	0	0	2	33	Female	50	33	Male	50	0	0	0	0	0	0	0	0	0	September	20	USD	200.0	January	0	0	0.0	February	0	0	0.0	March	0	0	0.0	April	0	0	0.0	May	0	0	0.0	June	0	0	0.0	Yes	Submission is subject to conditions previously worked with them	No	No	Male	Yes	Architectural engineering students	Home renovation supervision	No	المبلغ قليل جدا 	No	0	There is no change	I do not know anyone	Clothes	Rice	Not form above	0	0.0	0.0	0.0	0.0	0.0	10.0	0.0	0	0.0	0.0	0.0	0.0	0.0	0.0	0.0	0.0	20.0	0	0	0.0	0	0.0	0.0	0	0.0	1	1	0	0	0	0	0	0	1	0	0	0	0	0	0	0	0	0	0	0	0	0	0	0	0	0	0	0	0	0	0	0	0	1	0	0	0	0	0	0	0	0	0	0	0	Ramadan	0	0	0	0	0	0	0	840	employee in the body	How are the old houses of Sanaa being restored?	special activities	No	0.0	Yes	0	How are the designs of the old buildings of Sanaa?	How to build and the type of materials used	How is the historical kabani?	Preserving our heritage	None	None	Amanah Aleasimuh	Sanea' alqadima	Sanea' alqadimuh	50.0	33.0	33.0	University	University	University	100.0	2	50.0	33	Female	50.0	100.0	33.0	33.0	100.0	50	33.0	200.0	66.66666666666667
Female	24	No	5	Male	56	No	University	Yes	Female	53	No	University	Yes	Male	27	No	University	No	Female	24	No	University	Yes	Male	20	No	Completed secondary school	No	0	0	0	0	0	0	0	0	0	0	0	0	0	0	0	0	0	0	0	0	0	0	0	0	0	0	0	5	Yes	Yes	1	24	Female	0	0	0	0	0	0	0	0	3	56	Female	30	53	Female	20	24	Female	50	0	0	0	0	0	0	November	25	USD	150.0	December	25	USD	150.0	January	10	USD	50.0	February	0	0	0.0	March	0	0	0.0	April	0	0	0.0	May	0	0	0.0	Yes	The application was submitted and was subject to the conditions of the job training	Yes	Yes	Male	Yes	Complies with the terms and conditions of the program	Architectural Engineering	No	لم يتم توقيع عقود ولم نعرف كم المفترض يكون المبلغ 	No	0	Self prove	I do not know	Clothes	Rice	Sugar	0	0.0	0.0	15.0	10.0	20.0	18.0	50.0	0	5.0	1.0	10.0	10.0	20.0	0.0	0.0	0.0	50.0	0	0	0.0	0	0.0	0.0	0	0.0	2	2	0	0	0	0	0	0	0	1	0	0	0	0	0	0	0	0	0	1	0	0	0	0	0	0	0	0	0	0	0	0	0	1	0	0	0	0	0	0	0	0	0	0	0	in Ramadan	0	0	0	0	0	0	0	1500	A worker/employee in the authority	Quantity Calculation	There is no	No	0.0	Yes	0	Get to know the old fashioned	Get to know the ancient architecture	None	It is a heritage and it is necessary to preserve it	None	None	Amanah Aleasimuh	Sanea' alqadima	Sanea' alqadimuh	60.0	36.0	27.0	University	University	University	60.0	3	66.66666666666666	56	Male	20.0	100.0	24.0	24.0	60.0	100	39.4	350.0	70.0
Female	29	No	8	Male	58	No	No formal education	No	Male	35	No	Completed primary school	Yes	Male	32	Yes	Completed secondary school	Yes	Male	22	0	Completed secondary school	Yes	Female	49	0	Completed primary school	No	Female	29	0	University	Yes	Female	28	0	No formal education	No	Female	27	0	Some secondary school	No	0	0	0	0	0	0	0	0	0	0	4	2	14	Yes	No	1	29	Female	0	0	0	0	0	0	0	0	2	32	Male	70	29	Female	30	0	0	0	0	0	0	0	0	0	September	6	YER	30000.0	June	0	0	0.0	July	0	0	0.0	November	0	0	0.0	March	0	0	0.0	October	0	0	0.0	August	0	0	0.0	Yes	She was nominated by the Social Fund for Development	Yes	Yes	Male	Yes	Nominated by the Social Fund for Development	Nothing	Yes	0	No	0	I was able to help you buy some food for the family and pay off part of the debt	I do not know	Wheat flour	Sugar	Rice	0	25.0	0.0	15.0	0.0	0.0	10.0	0.0	0	0.0	0.0	0.0	0.0	0.0	0.0	0.0	0.0	0.0	0	0	0.0	0	0.0	0.0	0	0.0	1	1	0	0	0	0	0	0	0	0	0	0	0	0	0	0	0	0	0	0	0	0	0	0	0	0	0	0	1	0	0	0	1	0	0	0	0	0	0	0	0	0	0	0	Because the head of the family cannot get a job	0	0	0	0	0	0	0	0	1600	0	How do we protect ourselves from the corona virus and what are the things that a person infected with corona virus uses	There is no	No	0.0	Yes	0	None	None	None	How to preserve the old houses and archaeological sites	Knowing the locations of archaeological sites	Nothing	Alhadiduh	Zubid	Aljamie	50.0	35.0	30.5	Completed primary school	University	Some secondary school	50.0	4	25.0	32	Male	12.5	100.0	29.0	29.0	25.0	30	31.1	120.0	8.571428571428571
Female	32	No	2	Male	36	Yes	University	Yes	Female	32	0	University	No	0	0	0	0	0	0	0	0	0	0	0	0	0	0	0	0	0	0	0	0	0	0	0	0	0	0	0	0	0	0	0	0	0	0	0	0	0	0	0	0	0	1	3	Yes	No	1	32	Female	0	0	0	0	0	0	0	0	1	32	Female	100	0	0	0	0	0	0	0	0	0	0	0	0	September	6	YER	30000.0	October	0	0	0.0	November	0	0	0.0	December	0	0	0.0	March	0	0	0.0	April	0	0	0.0	June	0	0	0.0	Yes	Nominated by the Social Fund for Development	Yes	Yes	Male	Yes	he do not know	Computer courses	Yes	0	No	0	I got new information about the corona virus and was able to provide community service	I do not know	Clothes	Tools	Not form above	0	0.0	0.0	0.0	0.0	0.0	0.0	0.0	0	0.0	0.0	0.0	0.0	0.0	0.0	0.0	0.0	20.0	0	0	0.0	0	0.0	30.0	0	0.0	1	1	0	0	0	0	0	0	0	0	0	0	0	0	0	0	0	0	0	1	0	0	0	0	0	1	0	0	0	0	0	0	0	0	0	0	0	0	1	0	0	0	0	0	0	0	0	0	0	0	Because of the low income of the family	0	0	650	no	Things that a person infected with Corona virus should eat	There is no	No	0.0	Yes	0	Nothing	Nothing	Nothing	The locations of archaeological sites in Yemen	The locations of archaeological sites in Yemen	Nothing	Alhadiduh	Zubid	Aljamie	50.0	34.0	34.0	University	University	University	50.0	1	0.0	36	Male	50.0	100.0	32.0	32.0	50.0	100	32.0	120.0	40.0
Female	32	No	10	Male	62	No	No formal education	No	Male	47	No	Completed secondary school	Yes	Female	45	No	Completed primary school	No	Male	35	Yes	Completed secondary school	Yes	Male	30	0	Completed secondary school	Yes	Female	32	0	Completed secondary school	Yes	Female	25	0	Completed secondary school	No	Male	22	0	Completed secondary school	Yes	Female	20	0	Completed secondary school	No	Female	19	0	Completed secondary school	No	6	2	18	Yes	No	2	32	Female	35	Male	0	0	0	0	0	0	2	35	Male	80	32	Female	20	0	0	0	0	0	0	0	0	0	July	5	YER	15000.0	June	10	YER	30000.0	August	0	0	0.0	September	0	0	0.0	October	0	0	0.0	November	0	0	0.0	December	0	0	0.0	No	0	Yes	Yes	Male	No	0	She does not need any training because she is unable to work outside their home	Yes	0	No	0	Helped the family pay the water bill	I do not know	Water	Wheat flour	Not form above	0	25.0	0.0	0.0	0.0	0.0	0.0	0.0	0	0.0	0.0	0.0	0.0	0.0	0.0	50.0	0.0	0.0	0	0	0.0	0	0.0	0.0	0	0.0	1	1	0	0	0	0	0	0	0	0	0	0	0	0	0	0	0	1	0	0	0	0	0	0	0	0	0	0	0	0	1	0	0	0	0	0	0	0	0	0	0	0	Because it is rainy season	0	0	0	0	0	0	0	0	0	0	2600	0	Nothing	There is no	No	0.0	No	I can't work outside the house	Nothing	Nothing	Nothing	Nothing	Nothing	Nothing	Alhadayda	Zubid	Aljamie	50.0	33.7	31.0	Some secondary school	Completed secondary school	Completed secondary school	50.0	5	20.0	35	Male	20.0	50.0	33.5	33.5	20.0	20	34.4	180.0	10.0
